<?xml version="1.0" encoding="UTF-8"?>
<!DOCTYPE quests SYSTEM "quests.dtd">

<!-- Author: L2CCCP, Date: 01.11.2015, Time: 18:10 -->
<!-- Site: http://l2cccp.com/ -->
<quests>
	<quest id="298" type="SOLO">
		<name lang="en" val="Lizardmen's Conspiracy"/>
		<name lang="ru" val="Заговор Ящеров"/>
		<setting>
			<rate drop="1.0" reward="1.0" exp="1.0" sp="1.0"/>
			<event type="MOBKILLED" val="20922"/>	<!-- Maille Lizardman Warrior -->
			<event type="MOBKILLED" val="20923"/>	<!-- Maille Lizardman Shaman -->
			<event type="MOBKILLED" val="20924"/>	<!-- Maille Lizardman Matriarch -->
			<event type="MOBKILLED" val="20926"/>	<!-- Poison Araneid -->
			<event type="MOBKILLED" val="20927"/>	<!-- King of the Araneid -->
			<event type="QUEST_START" val="30333"/>	<!-- Praga -->
			<event type="QUEST_TALK" val="30333"/>	<!-- Praga -->
			<event type="QUEST_TALK" val="30333"/>	<!-- Praga -->
			<event type="QUEST_TALK" val="30344"/>	<!-- Rohmer -->
			<item id="7182"/>	<!-- Patrol's Report -->
			<item id="7183"/>	<!-- Shining Gem -->
			<item id="7184"/>	<!-- Shining Red Gem -->
		</setting>
	</quest>
</quests>
