<?xml version="1.0" encoding="UTF-8"?>
<!DOCTYPE quests SYSTEM "quests.dtd">

<!-- Author: L2CCCP, Date: 01.11.2015, Time: 18:10 -->
<!-- Site: http://l2cccp.com/ -->
<quests>
	<quest id="309" type="SOLO">
		<name lang="en" val="For a Good Cause"/>
		<name lang="ru" val="For a Good Cause"/>
		<setting>
			<rate drop="1.0" reward="1.0" exp="1.0" sp="1.0"/>
			<event type="MOBKILLED" val="22650"/>	<!-- Mucrokian Fanatic -->
			<event type="MOBKILLED" val="22651"/>	<!-- Mucrokian Ascetic -->
			<event type="MOBKILLED" val="22652"/>	<!-- Mucrokian Savior -->
			<event type="MOBKILLED" val="22653"/>	<!-- Mucrokian Preacher -->
			<event type="MOBKILLED" val="22654"/>	<!-- Contaminated Mucrokian -->
			<event type="MOBKILLED" val="22655"/>	<!-- Awakened Mucrokian -->
			<event type="QUEST_START" val="32647"/>	<!-- Atra -->
			<event type="QUEST_TALK" val="32647"/>	<!-- Atra -->
			<item id="14873"/>	<!-- Mucrokian Hide -->
			<item id="14874"/>	<!-- Fallen Mucrokian Hide -->
		</setting>
	</quest>
</quests>
