<?xml version="1.0" encoding="UTF-8"?>
<!DOCTYPE quests SYSTEM "quests.dtd">

<!-- Author: L2CCCP, Date: 01.11.2015, Time: 18:10 -->
<!-- Site: http://l2cccp.com/ -->
<quests>
	<quest id="712" type="SOLO">
		<name lang="en" val="Path to Becoming a Lord - Oren"/>
		<name lang="ru" val="Путь Лорда - Орен"/>
		<setting>
			<rate drop="1.0" reward="1.0" exp="1.0" sp="1.0"/>
			<event type="MOBKILLED" val="21261"/>	<!-- Ol Mahum Transcender -->
			<event type="MOBKILLED" val="20576"/>	<!-- Oel Mahum Witch Doctor -->
			<event type="MOBKILLED" val="20575"/>	<!-- Oel Mahum Warrior -->
			<event type="MOBKILLED" val="20161"/>	<!-- Oel Mahum -->
			<event type="QUEST_START" val="35226"/>	<!-- Brasseur -->
			<event type="QUEST_START" val="30169"/>	<!-- Marty -->
			<event type="QUEST_TALK" val="35226"/>	<!-- Brasseur -->
			<event type="QUEST_TALK" val="30169"/>	<!-- Marty -->
			<event type="QUEST_TALK" val="30676"/>	<!-- Croop -->
			<event type="QUEST_TALK" val="30176"/>	<!-- Valleria -->
		</setting>
	</quest>
</quests>
