<?xml version="1.0" encoding="UTF-8"?>
<!DOCTYPE quests SYSTEM "quests.dtd">

<!-- Author: L2CCCP, Date: 01.11.2015, Time: 18:10 -->
<!-- Site: http://l2cccp.com/ -->
<quests>
	<quest id="324" type="SOLO">
		<name lang="en" val="Sweetest Venom"/>
		<name lang="ru" val="Сладчайший яд"/>
		<setting>
			<rate drop="1.0" reward="1.0" exp="1.0" sp="1.0"/>
			<event type="MOBKILLED" val="20034"/>	<!-- Prowler -->
			<event type="MOBKILLED" val="20038"/>	<!-- Venomous Spider -->
			<event type="MOBKILLED" val="20043"/>	<!-- Arachnid Tracker -->
			<event type="QUEST_START" val="30351"/>	<!-- Astaron -->
			<event type="QUEST_TALK" val="30351"/>	<!-- Astaron -->
			<item id="1077"/>	<!-- Venom Sac -->
		</setting>
	</quest>
</quests>
