<?xml version="1.0" encoding="UTF-8"?>
<!DOCTYPE quests SYSTEM "quests.dtd">

<!-- Author: L2CCCP, Date: 01.11.2015, Time: 18:10 -->
<!-- Site: http://l2cccp.com/ -->
<quests>
	<quest id="646" type="SOLO">
		<name lang="en" val="Signs of Revolt"/>
		<name lang="ru" val="Признаки восстания"/>
		<setting>
			<rate drop="1.0" reward="1.0" exp="1.0" sp="1.0"/>
			<event type="MOBKILLED" val="22691"/>	<!-- Ragna Orc -->
			<event type="MOBKILLED" val="22692"/>	<!-- Ragna Orc Warrior -->
			<event type="MOBKILLED" val="22693"/>	<!-- Ragna Orc Hero -->
			<event type="MOBKILLED" val="22694"/>	<!-- Ragna Orc Commander -->
			<event type="MOBKILLED" val="22695"/>	<!-- Ragna Orc Healer -->
			<event type="MOBKILLED" val="22696"/>	<!-- Ragna Orc Shaman -->
			<event type="MOBKILLED" val="22697"/>	<!-- Ragna Orc Seer -->
			<event type="MOBKILLED" val="22698"/>	<!-- Ragna Orc Archer -->
			<event type="MOBKILLED" val="22699"/>	<!-- Ragna Orc Sniper -->
			<event type="QUEST_START" val="32016"/>	<!-- Torrant -->
			<event type="QUEST_TALK" val="32016"/>	<!-- Torrant -->
			<item id="8087"/>	<!-- Cursed Doll -->
		</setting>
	</quest>
</quests>
