<?xml version="1.0" encoding="UTF-8"?>
<!DOCTYPE quests SYSTEM "quests.dtd">

<!-- Author: L2CCCP, Date: 01.11.2015, Time: 18:10 -->
<!-- Site: http://l2cccp.com/ -->
<quests>
	<quest id="316" type="SOLO">
		<name lang="en" val="Destroy Plague Carriers"/>
		<name lang="ru" val="Разносчики чумы"/>
		<setting>
			<rate drop="1.0" reward="1.0" exp="1.0" sp="1.0"/>
			<event type="MOBKILLED" val="20040"/>	<!-- Sukar Wererat -->
			<event type="MOBKILLED" val="20047"/>	<!-- Sukar Wererat Leader -->
			<event type="MOBKILLED" val="27020"/>	<!-- Varool Foulclaw -->
			<event type="QUEST_START" val="30155"/>	<!-- Ellenia -->
			<event type="QUEST_TALK" val="30155"/>	<!-- Ellenia -->
			<item id="1042"/>	<!-- Wererat's Fang -->
			<item id="1043"/>	<!-- Varool Foulclaw's Fang -->
		</setting>
	</quest>
</quests>
