<?xml version="1.0" encoding="UTF-8"?>
<!DOCTYPE quests SYSTEM "quests.dtd">

<!-- Author: L2CCCP, Date: 01.11.2015, Time: 18:10 -->
<!-- Site: http://l2cccp.com/ -->
<quests>
	<quest id="265" type="SOLO">
		<name lang="en" val="Chains of Slavery"/>
		<name lang="ru" val="Цепи рабства"/>
		<setting>
			<rate drop="1.0" reward="1.0" exp="1.0" sp="1.0"/>
			<event type="MOBKILLED" val="20004"/>	<!-- Imp -->
			<event type="MOBKILLED" val="20005"/>	<!-- Imp Elder -->
			<event type="QUEST_START" val="30357"/>	<!-- Kristin -->
			<event type="QUEST_TALK" val="30357"/>	<!-- Kristin -->
			<item id="1368"/>	<!-- Imp Shackles -->
		</setting>
	</quest>
</quests>
