<?xml version="1.0" encoding="UTF-8"?>
<!DOCTYPE quests SYSTEM "quests.dtd">

<!-- Author: L2CCCP, Date: 01.11.2015, Time: 18:10 -->
<!-- Site: http://l2cccp.com/ -->
<quests>
	<quest id="195" type="SOLO">
		<name lang="en" val="Seven Sign, Secret Ritual of the Priests"/>
		<name lang="ru" val="Семь Печатей, Тайные Знания Жрецов"/>
		<setting>
			<rate drop="1.0" reward="1.0" exp="1.0" sp="1.0"/>
			<event type="QUEST_START" val="31001"/>	<!-- Claudia Athebaldt -->
			<event type="QUEST_TALK" val="31001"/>	<!-- Claudia Athebaldt -->
			<event type="QUEST_TALK" val="32576"/>	<!-- John -->
			<event type="QUEST_TALK" val="30289"/>	<!-- Raymond -->
			<event type="QUEST_TALK" val="32575"/>	<!-- Light of Dawn -->
			<event type="QUEST_TALK" val="32578"/>	<!-- Identity Confirm Device -->
			<event type="QUEST_TALK" val="32577"/>	<!-- Password Entry Device -->
			<event type="QUEST_TALK" val="32580"/>	<!-- bookshelf1_dawn -->
			<event type="QUEST_TALK" val="30969"/>	<!-- Iason Heine -->
			<item id="13822"/>	<!-- Guards of the Dawn Identity Card -->
			<item id="13823"/>	<!-- Emperor Shunaiman's Contract -->
		</setting>
	</quest>
</quests>
