<?xml version="1.0" encoding="UTF-8"?>
<!DOCTYPE quests SYSTEM "quests.dtd">

<!-- Author: L2CCCP, Date: 01.11.2015, Time: 18:10 -->
<!-- Site: http://l2cccp.com/ -->
<quests>
	<quest id="10277" type="PARTY_ALL">
		<name lang="en" val="Mutated Kaneus - Dion"/>
		<name lang="ru" val="Мутант Канеус - Дион"/>
		<setting>
			<rate drop="1.0" reward="1.0" exp="1.0" sp="1.0"/>
			<event type="MOBKILLED" val="18558"/>	<!-- Crimson Hatu Otis -->
			<event type="MOBKILLED" val="18559"/>	<!-- Seer Flouros -->
			<event type="QUEST_START" val="30071"/>	<!-- Lucas -->
			<event type="QUEST_TALK" val="30071"/>	<!-- Lucas -->
			<event type="QUEST_TALK" val="30461"/>	<!-- Mirien -->
			<item id="13832"/>	<!-- Crimson Hatu Otis' Cellular Tissue -->
			<item id="13833"/>	<!-- Seer Flouros' Cellular Tissue -->
		</setting>
	</quest>
</quests>
