<?xml version="1.0" encoding="UTF-8"?>
<!DOCTYPE quests SYSTEM "quests.dtd">

<!-- Author: L2CCCP, Date: 01.11.2015, Time: 18:10 -->
<!-- Site: http://l2cccp.com/ -->
<quests>
	<quest id="144" type="SOLO">
		<name lang="en" val="Pailaka - Injured Dragon"/>
		<name lang="ru" val="Пайлака - Дракон"/>
		<setting>
			<rate drop="1.0" reward="1.0" exp="1.0" sp="1.0"/>
			<event type="MOBGOTATTACKED" val="18660"/>	<!-- Latana -->
			<event type="MOBGOTATTACKED" val="18636"/>	<!-- Varka Silenos Footman -->
			<event type="MOBGOTATTACKED" val="18642"/>	<!-- Varka Silenos Warrior -->
			<event type="MOBGOTATTACKED" val="18646"/>	<!-- Varka Silenos Officer -->
			<event type="MOBGOTATTACKED" val="18654"/>	<!-- Varkas Commander -->
			<event type="MOBGOTATTACKED" val="18649"/>	<!-- Varka Silenos Great Magus -->
			<event type="MOBGOTATTACKED" val="18650"/>	<!-- Varka Silenos General -->
			<event type="MOBGOTATTACKED" val="18655"/>	<!-- Varkas Head Guard -->
			<event type="MOBGOTATTACKED" val="18657"/>	<!-- Prophet Guard -->
			<event type="MOBKILLED" val="18660"/>	<!-- Latana -->
			<event type="MOBKILLED" val="18635"/>	<!-- Varka Silenos Recruit -->
			<event type="MOBKILLED" val="18636"/>	<!-- Varka Silenos Footman -->
			<event type="MOBKILLED" val="18638"/>	<!-- Varka Silenos Scout -->
			<event type="MOBKILLED" val="18639"/>	<!-- Varka Silenos Hunter -->
			<event type="MOBKILLED" val="18640"/>	<!-- Varka Silenos Shaman -->
			<event type="MOBKILLED" val="18641"/>	<!-- Varka Silenos Priest -->
			<event type="MOBKILLED" val="18642"/>	<!-- Varka Silenos Warrior -->
			<event type="MOBKILLED" val="18644"/>	<!-- Varka Silenos Medium -->
			<event type="MOBKILLED" val="18645"/>	<!-- Varka Silenos Magus -->
			<event type="MOBKILLED" val="18646"/>	<!-- Varka Silenos Officer -->
			<event type="MOBKILLED" val="18648"/>	<!-- Varka Silenos Seer -->
			<event type="MOBKILLED" val="18649"/>	<!-- Varka Silenos Great Magus -->
			<event type="MOBKILLED" val="18650"/>	<!-- Varka Silenos General -->
			<event type="MOBKILLED" val="18652"/>	<!-- Varka Silenos Great Seer -->
			<event type="MOBKILLED" val="18653"/>	<!-- Varkas Elite Guard -->
			<event type="MOBKILLED" val="18654"/>	<!-- Varkas Commander -->
			<event type="MOBKILLED" val="18655"/>	<!-- Varkas Head Guard -->
			<event type="MOBKILLED" val="18656"/>	<!-- Varkas Head Magus -->
			<event type="MOBKILLED" val="18657"/>	<!-- Prophet Guard -->
			<event type="MOBKILLED" val="18658"/>	<!-- Disciple of Prophet -->
			<event type="MOBKILLED" val="18659"/>	<!-- Varkas Prophet -->
			<event type="MOBKILLED" val="18637"/>	<!-- Grazing Antelope -->
			<event type="MOBKILLED" val="18643"/>	<!-- Grazing Antelope -->
			<event type="MOBKILLED" val="18647"/>	<!-- Grazing Flava -->
			<event type="MOBKILLED" val="18651"/>	<!-- Grazing Elder Antelope -->
			<event type="QUEST_START" val="32499"/>	<!-- Ketra Orc Shaman  -->
			<event type="QUEST_TALK" val="32499"/>	<!-- Ketra Orc Shaman  -->
			<event type="QUEST_TALK" val="32502"/>	<!-- Ketra Orc Supporter -->
			<event type="QUEST_TALK" val="32509"/>	<!-- Ketra Orc Intelligence Officer -->
			<event type="QUEST_TALK" val="32512"/>	<!-- Ketra Orc Supporter -->
			<item id="13056"/>	<!-- Weapon Upgrade Stage 1 -->
			<item id="13057"/>	<!-- Weapon Upgrade Stage 2 -->
			<item id="13052"/>	<!-- Spear of Silenos -->
			<item id="13053"/>	<!-- Enhanced Spear of Silenos -->
			<item id="13054"/>	<!-- Complete Spear of Silenos -->
			<item id="13033"/>	<!-- Quick Healing Potion -->
			<item id="13032"/>	<!-- Pailaka Instant Shield -->
		</setting>
	</quest>
</quests>
