<?xml version="1.0" encoding="UTF-8"?>
<!DOCTYPE quests SYSTEM "quests.dtd">

<!-- Author: L2CCCP, Date: 01.11.2015, Time: 18:10 -->
<!-- Site: http://l2cccp.com/ -->
<quests>
	<quest id="274" type="SOLO">
		<name lang="en" val="Skirmish with the Werewolves"/>
		<name lang="ru" val="Стычка с оборотнями"/>
		<setting>
			<rate drop="1.0" reward="1.0" exp="1.0" sp="1.0"/>
			<event type="MOBKILLED" val="20363"/>	<!-- Maraku Werewolf -->
			<event type="MOBKILLED" val="20364"/>	<!-- Maraku Werewolf Chieftain -->
			<event type="QUEST_START" val="30569"/>	<!-- Brukurse -->
			<event type="QUEST_TALK" val="30569"/>	<!-- Brukurse -->
			<item id="1477"/>	<!-- Maraku Werewolf Head -->
		</setting>
	</quest>
</quests>
