<?xml version="1.0" encoding="UTF-8"?>
<!DOCTYPE quests SYSTEM "quests.dtd">

<!-- Author: L2CCCP, Date: 01.11.2015, Time: 18:10 -->
<!-- Site: http://l2cccp.com/ -->
<quests>
	<quest id="367" type="SOLO">
		<name lang="en" val="Electrifying Recharge!"/>
		<name lang="ru" val="Подзарядка электричеством"/>
		<setting>
			<rate drop="1.0" reward="1.0" exp="1.0" sp="1.0"/>
			<event type="MOBKILLED" val="21035"/>	<!-- Catherok -->
			<event type="QUEST_START" val="30673"/>	<!-- Lorain -->
			<event type="QUEST_TALK" val="30673"/>	<!-- Lorain -->
			<item id="5875"/>	<!-- Titan Lamp -->
			<item id="5876"/>	<!-- Titan Lamp -->
			<item id="5877"/>	<!-- Titan Lamp -->
			<item id="5878"/>	<!-- Titan Lamp -->
			<item id="5879"/>	<!-- Titan Lamp -->
			<item id="5880"/>	<!-- Broken Titan Lamp -->
		</setting>
	</quest>
</quests>
