<?xml version="1.0" encoding="UTF-8"?>
<!DOCTYPE quests SYSTEM "quests.dtd">

<!-- Author: L2CCCP, Date: 01.11.2015, Time: 18:10 -->
<!-- Site: http://l2cccp.com/ -->
<quests>
	<quest id="691" type="PARTY_ONE">
		<name lang="en" val="Matras' Suspicious Request"/>
		<name lang="ru" val="Подозрительная просьба Мэтреса"/>
		<setting>
			<rate drop="1.0" reward="1.0" exp="1.0" sp="1.0"/>
			<event type="MOBKILLED" val="22363"/>	<!-- Body Destroyer -->
			<event type="MOBKILLED" val="22364"/>	<!-- Soul Dominator -->
			<event type="MOBKILLED" val="22365"/>	<!-- Labyrinth Watchman -->
			<event type="MOBKILLED" val="22366"/>	<!-- Labyrinth Watchman -->
			<event type="MOBKILLED" val="22367"/>	<!-- Labyrinth Mystic -->
			<event type="MOBKILLED" val="22368"/>	<!-- Labyrinth Captain -->
			<event type="MOBKILLED" val="22369"/>	<!-- Labyrinth Seer -->
			<event type="MOBKILLED" val="22370"/>	<!-- Passageway Captain -->
			<event type="MOBKILLED" val="22371"/>	<!-- Passageway Guards -->
			<event type="MOBKILLED" val="22372"/>	<!-- Passageway Mystic -->
			<event type="QUEST_START" val="32245"/>	<!-- Matras -->
			<event type="QUEST_TALK" val="32245"/>	<!-- Matras -->
			<item id="10372"/>	<!-- Red Stone -->
		</setting>
	</quest>
</quests>
