<?xml version="1.0" encoding="UTF-8"?>
<!DOCTYPE quests SYSTEM "quests.dtd">

<!-- Author: L2CCCP, Date: 01.11.2015, Time: 18:10 -->
<!-- Site: http://l2cccp.com/ -->
<quests>
	<quest id="10284" type="SOLO">
		<name lang="en" val="Acquisition Of Divine Sword"/>
		<name lang="ru" val="Получение чудесного меча"/>
		<setting>
			<rate drop="1.0" reward="1.0" exp="1.0" sp="1.0"/>
			<event type="MOBKILLED" val="18846"/>	<!-- Kegor -->
			<event type="MOBKILLED" val="22766"/>	<!-- Mithril Millipede -->
			<event type="QUEST_START" val="32020"/>	<!-- Rafforty -->
			<event type="QUEST_TALK" val="32020"/>	<!-- Rafforty -->
			<event type="QUEST_TALK" val="32020"/>	<!-- Rafforty -->
			<event type="QUEST_TALK" val="32760"/>	<!-- Jinia  -->
			<event type="QUEST_TALK" val="32653"/>	<!-- Krun -->
			<event type="QUEST_TALK" val="32654"/>	<!-- Tarun -->
			<event type="QUEST_TALK" val="32653"/>	<!-- Krun -->
			<event type="QUEST_TALK" val="32654"/>	<!-- Tarun -->
			<event type="QUEST_TALK" val="18846"/>	<!-- Kegor -->
		</setting>
	</quest>
</quests>
