<?xml version="1.0" encoding="UTF-8"?>
<!DOCTYPE quests SYSTEM "quests.dtd">

<!-- Author: L2CCCP, Date: 01.11.2015, Time: 18:10 -->
<!-- Site: http://l2cccp.com/ -->
<quests>
	<quest id="159" type="SOLO">
		<name lang="en" val="Protect the Water Source"/>
		<name lang="ru" val="Защита водного источника"/>
		<setting>
			<rate drop="1.0" reward="1.0" exp="1.0" sp="1.0"/>
			<event type="MOBKILLED" val="27017"/>	<!-- Plague Zombie -->
			<event type="QUEST_START" val="30154"/>	<!-- Asterios -->
			<event type="QUEST_TALK" val="30154"/>	<!-- Asterios -->
			<item id="1035"/>	<!-- Plague Dust -->
			<item id="1071"/>	<!-- Hyacinth Charm -->
			<item id="1072"/>	<!-- Hyacinth Charm -->
		</setting>
	</quest>
</quests>
