<?xml version="1.0" encoding="UTF-8"?>
<!DOCTYPE quests SYSTEM "quests.dtd">

<!-- Author: L2CCCP, Date: 01.11.2015, Time: 18:10 -->
<!-- Site: http://l2cccp.com/ -->
<quests>
	<quest id="198" type="SOLO">
		<name lang="en" val="Seven Sign, Embryo"/>
		<name lang="ru" val="Семь Печатей, Эмбрио"/>
		<setting>
			<rate drop="1.0" reward="1.0" exp="1.0" sp="1.0"/>
			<event type="MOBKILLED" val="27346"/>	<!-- Shilens Evil Thoughts -->
			<event type="QUEST_START" val="32593"/>	<!-- Wood -->
			<event type="QUEST_TALK" val="32593"/>	<!-- Wood -->
			<event type="QUEST_TALK" val="32597"/>	<!-- Franz -->
			<event type="QUEST_TALK" val="32582"/>	<!-- Jaina -->
			<item id="14360"/>	<!-- Sculpture of Doubt -->
		</setting>
	</quest>
</quests>
