<?xml version="1.0" encoding="UTF-8"?>
<!DOCTYPE quests SYSTEM "quests.dtd">

<!-- Author: L2CCCP, Date: 01.11.2015, Time: 18:10 -->
<!-- Site: http://l2cccp.com/ -->
<quests>
	<quest id="188" type="SOLO">
		<name lang="en" val="Seal Removal"/>
		<name lang="ru" val="Снятие Печати"/>
		<setting>
			<rate drop="1.0" reward="1.0" exp="1.0" sp="1.0"/>
			<event type="NPC_FIRST_TALK" val="30673"/>	<!-- Lorain -->
			<event type="QUEST_TALK" val="30970"/>	<!-- Dorothy -->
			<event type="QUEST_TALK" val="30621"/>	<!-- Nikola -->
			<event type="QUEST_TALK" val="30673"/>	<!-- Lorain -->
			<item id="10369"/>	<!-- Broken Metal Pieces -->
		</setting>
	</quest>
</quests>
