<?xml version="1.0" encoding="UTF-8"?>
<!DOCTYPE quests SYSTEM "quests.dtd">

<!-- Author: L2CCCP, Date: 01.11.2015, Time: 18:10 -->
<!-- Site: http://l2cccp.com/ -->
<quests>
	<quest id="10502" type="PARTY_ALL">
		<name lang="en" val="Freya Embroidered Soul Cloak"/>
		<name lang="ru" val="Плащ с вышитой душой -2 (Фрея)"/>
		<setting>
			<rate drop="1.0" reward="1.0" exp="1.0" sp="1.0"/>
			<event type="MOBKILLED" val="29179"/>	<!-- Freya -->
			<event type="MOBKILLED" val="29180"/>	<!-- Freya -->
			<event type="QUEST_START" val="32612"/>	<!-- Olf Adams -->
			<event type="QUEST_TALK" val="32612"/>	<!-- Olf Adams -->
			<event type="QUEST_TALK" val="32612"/>	<!-- Olf Adams -->
			<item id="21723"/>	<!-- Freya Soul Fragment -->
		</setting>
	</quest>
</quests>
