<?xml version="1.0" encoding="UTF-8"?>
<!DOCTYPE quests SYSTEM "quests.dtd">

<!-- Author: L2CCCP, Date: 01.11.2015, Time: 18:10 -->
<!-- Site: http://l2cccp.com/ -->
<quests>
	<quest id="35" type="SOLO">
		<name lang="en" val="Find Glittering Jewelry"/>
		<name lang="ru" val="Свадебные украшения"/>
		<setting>
			<rate drop="1.0" reward="1.0" exp="1.0" sp="1.0"/>
			<event type="MOBKILLED" val="20135"/>	<!-- Alligator -->
			<event type="QUEST_START" val="30091"/>	<!-- Ellie -->
			<event type="QUEST_TALK" val="30091"/>	<!-- Ellie -->
			<event type="QUEST_TALK" val="30091"/>	<!-- Ellie -->
			<event type="QUEST_TALK" val="30879"/>	<!-- Felton -->
			<item id="7162"/>	<!-- Rough Jewel -->
		</setting>
	</quest>
</quests>
